{
  "schemaVersion": "pv-biblia-v1",
  "bookId": "43",
  "bookName": "João",
  "chapter": 3,
  "_teste": true,
  "verses": [
    {
      "verse": 16,
      "text": "Porque Deus amou o mundo de tal maneira que deu o seu Filho unigênito, para que todo aquele que nele crê não pereça, mas tenha a vida eterna. [Texto de teste]"
    }
  ]
}
